{
  "delta_id": "DELTA:SYS:v1.3:v1.4:4a9b2c1d",
  "from_version": "v1.3",
  "to_version": "v1.4",
  "timestamp": "2025-09-03T00:20:00Z",
  "operations": [
    {
      "operation": "~",
      "level": "Architecture",
      "component": "multi-bubble-topology",
      "magnitude": 3.5,
      "risk": "Medium",
      "impact": "System",
      "reversible": true,
      "description": "Multi-bubble topology modified (10→12 vessels)",
      "before": {"vessel_count": 10, "configuration": "standard"},
      "after": {"vessel_count": 12, "configuration": "enhanced"},
      "dependencies": ["pressure-vessel-system", "structural-interface"],
      "trace_refs": ["REQ:BWB-Q100-AAA-PRESSURE-001"]
    },
    {
      "operation": "↑",
      "level": "Performance",
      "component": "fatigue-life",
      "magnitude": 4.2,
      "risk": "Low",
      "impact": "System",
      "reversible": false,
      "description": "Fatigue life improved (195k→212k cycles)",
      "before": {"cycles": 195000, "safety_factor": 1.5},
      "after": {"cycles": 212000, "safety_factor": 1.6},
      "dependencies": ["material-properties", "stress-analysis"],
      "trace_refs": ["REQ:BWB-Q100-AAA-FATIGUE-001"]
    },
    {
      "operation": "+",
      "level": "Component",
      "component": "quantum-confidence-monitor",
      "magnitude": 2.8,
      "risk": "Low",
      "impact": "Local",
      "reversible": true,
      "description": "Added quantum confidence monitoring",
      "after": {"confidence_threshold": 0.75, "monitoring_enabled": true},
      "dependencies": ["quantum-processing-unit"],
      "trace_refs": ["REQ:BWB-Q100-CQH-QUANTUM-001"]
    }
  ],
  "summary": {
    "total_operations": 3,
    "by_operation": {
      "added": 1,
      "removed": 0,
      "modified": 1,
      "enhanced": 1,
      "degraded": 0,
      "critical": 0
    },
    "by_level": {
      "component": 1,
      "interface": 0,
      "requirement": 0,
      "performance": 1,
      "architecture": 1
    },
    "risk_distribution": {
      "low": 2,
      "medium": 1,
      "high": 0
    },
    "overall_magnitude": 3.5,
    "breaking_changes": 0
  },
  "paradigm_shift": {
    "score": 3.7,
    "classification": "Incremental",
    "innovation_index": 6.2,
    "disruption_level": "Moderate"
  },
  "signature": "0x2f8a3b9c1d7e4f5a6b0c8d9e2f1a4b5c7d8e9f0a1b2c3d4e5f6a7b8c9d0e1f2"
}